{
  "$schema": "https://json-schema.org/draft/2020-12/schema",
  "title": "物品列表",
  "type": "array",
  "items": {
    "type": "object",
    "required": ["id", "name", "image", "description", "inspectEvent"],
    "properties": {
      "id": { "$ref": "#/$defs/id" },
      "name": { "type": "string", "minLength": 1 },
      "image": { "type": "string", "minLength": 1 },
      "description": { "type": "string" },
      "inspectEvent": { "$ref": "#/$defs/id" }
    },
    "additionalProperties": false
  },
  "$defs": {
    "id": { "type": "string", "pattern": "^[A-Za-z][A-Za-z0-9_-]*$" }
  }
}
