[
  {
    "id": "note_06_item",
    "name": "便签",
    "image": "assets/note.png",
    "description": "从 6 号车厢门上取下来的便签。",
    "inspectEvent": "E_NOTE_06_ITEM"
  },
  {
    "id": "old_ticket",
    "name": "旧车票",
    "image": "assets/note.svg",
    "description": "一张已经褪色的车票，背面写着无法辨认的日期。",
    "inspectEvent": "E_903"
  },
  {
    "id": "bottle",
    "name": "彩色玻璃瓶",
    "image": "assets/bottle-inner.png",
    "description": "从诡异的花草车厢里捡到的空瓶子，瓶身是粉红色的普通玻璃。",
    "inspectEvent": "E_023_BOTTLE"
  },
  {
    "id": "newspaper",
    "name": "报纸",
    "image": "assets/newspaper-icon.png",
    "description": "标题：昨晚1号线电车的末班车遭遇大规模恐怖事件，幸存者精神异常被送医，警方调查困难。",
    "inspectEvent": "E_ITEM_NEWSPAPER_INSPECT"
  },
  {
    "id": "crew_keys",
    "name": "驾驶室与操作面板钥匙",
    "image": "assets/placeholder-key.svg",
    "description": "驾驶室钥匙和操作面板钥匙。",
    "inspectEvent": "E_ITEM_KEYS_INSPECT"
  },
  {
    "id": "phone",
    "name": "手机",
    "image": "assets/phone.png",
    "description": "一部手机。",
    "inspectEvent": "E_ITEM_PHONE_INSPECT"
  },
  {
    "id": "flashlight",
    "name": "手电筒",
    "image": "assets/flashlight.png",
    "description": "一支还能发光的手电筒。",
    "inspectEvent": "E_ITEM_FLASHLIGHT_INSPECT"
  },
  {
    "id": "emergency_cutter",
    "name": "应急割带器",
    "image": "assets/placeholder-key.svg",
    "description": "可以割断黑色背包背带的应急工具。",
    "inspectEvent": "E_ITEM_EMERGENCY_CUTTER_INSPECT"
  },
  {
    "id": "pry_bar",
    "name": "撬杆",
    "image": "assets/placeholder-key.svg",
    "description": "可以撬开被行李压住的箱体。",
    "inspectEvent": "E_ITEM_PRY_BAR_INSPECT"
  }
]
